{
  "$schema": "https://json-schema.org/draft/2020-12/schema",
  "$id": "https://pet.local/schemas/v1/cat-skeleton.schema.json",
  "title": "PET Cat Skeleton Definition v1",
  "description": "Defines the bone hierarchy, joint positions, rest angles, sprite mapping, and draw order for the PET cat character. The skeleton is shared between the renderer (FK) and the motion generator (bone rotation ordering).",
  "type": "object",
  "additionalProperties": false,
  "required": [
    "schema",
    "canvas",
    "displayScale",
    "footAnchor",
    "sourceFacing",
    "bones",
    "drawOrder"
  ],
  "properties": {
    "schema": {
      "const": "pet-skeleton-v1"
    },
    "canvas": {
      "type": "array",
      "minItems": 2,
      "maxItems": 2,
      "items": {
        "type": "integer",
        "minimum": 16,
        "maximum": 512
      },
      "description": "Width and height of the sprite canvas in pixels."
    },
    "displayScale": {
      "type": "integer",
      "minimum": 1,
      "maximum": 8,
      "description": "Scale factor for display (2 = 48px canvas displayed at 96px)."
    },
    "footAnchor": {
      "type": "array",
      "minItems": 2,
      "maxItems": 2,
      "items": { "type": "number" },
      "description": "The foot anchor position [x, y] in canvas pixel coordinates. This is where the pet stands on surfaces."
    },
    "sourceFacing": {
      "enum": [-1, 1],
      "description": "Default facing direction of the source sprite (-1 = facing left, 1 = facing right)."
    },
    "bones": {
      "type": "array",
      "minItems": 1,
      "maxItems": 64,
      "items": { "$ref": "#/$defs/bone" }
    },
    "drawOrder": {
      "type": "array",
      "minItems": 1,
      "maxItems": 64,
      "items": { "$ref": "#/$defs/boneId" },
      "description": "Render order of bone sprites from back to front."
    },
    "facialDefaults": {
      "type": "object",
      "additionalProperties": false,
      "properties": {
        "eyePosition": {
          "type": "array",
          "minItems": 2,
          "maxItems": 2,
          "items": { "type": "number" },
          "description": "Default eye center position [x, y] on the head sprite (local coordinates)."
        },
        "mouthPosition": {
          "type": "array",
          "minItems": 2,
          "maxItems": 2,
          "items": { "type": "number" },
          "description": "Default mouth center position [x, y] on the head sprite (local coordinates)."
        }
      }
    }
  },
  "$defs": {
    "boneId": {
      "type": "string",
      "minLength": 1,
      "maxLength": 64,
      "pattern": "^[a-z][a-z0-9_]*$"
    },
    "bone": {
      "type": "object",
      "additionalProperties": false,
      "required": ["id", "parent", "joint", "length", "restAngle"],
      "properties": {
        "id": { "$ref": "#/$defs/boneId" },
        "name": {
          "type": "string",
          "maxLength": 128,
          "description": "Human-readable bone name for debugging."
        },
        "parent": {
          "oneOf": [
            { "type": "null" },
            { "$ref": "#/$defs/boneId" }
          ],
          "description": "Parent bone id. null for the root bone."
        },
        "joint": {
          "type": "array",
          "minItems": 2,
          "maxItems": 2,
          "items": { "type": "number" },
          "description": "Joint position [x, y] in canvas pixel coordinates."
        },
        "length": {
          "type": "number",
          "minimum": 0,
          "maximum": 512,
          "description": "Bone length in canvas pixels."
        },
        "restAngle": {
          "type": "number",
          "minimum": -3.1416,
          "maximum": 3.1416,
          "description": "Rest angle in radians relative to parent bone direction (0 = aligned with parent)."
        },
        "sprite": {
          "oneOf": [
            { "type": "string", "maxLength": 64 },
            { "type": "null" }
          ],
          "description": "Sprite layer name referenced in the asset manifest. null for bones without their own sprite (e.g., ears that only affect head deformation)."
        },
        "limits": {
          "type": "object",
          "additionalProperties": false,
          "properties": {
            "rotation": {
              "type": "array",
              "minItems": 2,
              "maxItems": 2,
              "items": { "type": "number" },
              "description": "Rotation limits [min, max] in radians relative to restAngle."
            }
          }
        },
        "physics": {
          "type": "object",
          "additionalProperties": false,
          "properties": {
            "mode": {
              "enum": ["model_driven", "secondary", "static"],
              "description": "model_driven: model outputs rotation. secondary: renderer applies physics. static: bone never rotates."
            },
            "damping": {
              "type": "number",
              "minimum": 0,
              "maximum": 1,
              "description": "Damping coefficient for secondary physics (0 = instant follow, 1 = no damping)."
            },
            "stiffness": {
              "type": "number",
              "minimum": 0,
              "maximum": 1,
              "description": "Spring stiffness for secondary physics (0 = no return force, 1 = instant return)."
            },
            "inertiaFactor": {
              "type": "number",
              "minimum": 0,
              "maximum": 2,
              "description": "Inertia multiplier for secondary physics."
            }
          }
        }
      }
    }
  }
}
